<?xml version="1.0" encoding="utf-8" ?>
<Feature SiLA2Version="1.0" FeatureVersion="1.0" MaturityLevel="Verified" Originator="org.silastandard" Category="core"
         xmlns="http://www.sila-standard.org"
         xmlns:xsi="http://www.w3.org/2001/XMLSchema-instance"
         xsi:schemaLocation="http://www.sila-standard.org https://gitlab.com/SiLA2/sila_base/raw/master/schema/FeatureDefinition.xsd">
    <Identifier>SimulationController</Identifier>
    <DisplayName>Simulation Controller</DisplayName>
    <Description>
        This Feature provides control over the simulation behaviour of a SiLA Server.

        A SiLA Server can run in two modes:
        (a) a real mode - with real activities, e.g. addressing or controlling real hardware,
        writing to real databases, moving real plates etc.
        (b) a simulation mode - where every command is only simulated and responses are just example returns.

        Note that certain commands and properties might not be affected by this feature if they
        do not interact with the real world.
    </Description>
    <Command>
        <Identifier>StartSimulationMode</Identifier>
        <DisplayName>Start Simulation Mode </DisplayName>
        <Description>
			Sets the SiLA Server to run in simulation mode, i.e. all following commands are executed in simulation mode.
			The simulation mode can be stopped by issuing the 'Start Real Mode' command.
		</Description>
        <Observable>No</Observable>
    </Command>
    <Command>
        <Identifier>StartRealMode</Identifier>
        <DisplayName>Start Real Mode</DisplayName>
        <Description>
			Sets the SiLA Server to run in real mode, i.e. all following commands are executed in real mode.
			The real mode can be stopped by issuing the 'Start Simulation Mode' command.
		</Description>
        <Observable>No</Observable>
    </Command>
    <Property>
        <Identifier>SimulationMode</Identifier>
        <DisplayName>SimulationMode</DisplayName>
        <Description>Indication whether SiLA Server is in Simulation Mode or not.</Description>
        <Observable>No</Observable>
        <DataType>
            <Basic>Boolean</Basic>
        </DataType>
    </Property>
</Feature>